{
  "schema_version": 2,
  "fedora_release": 44,
  "fedora_package_names_file": "config/fedora-44-package-names.txt",
  "producers": [
    {
      "repository": "Project-Ro-ASD/ro-Control",
      "owner": "Project-Ro-ASD/ro-Control maintainers",
      "components": [
        {
          "component": "ro-control",
          "package_names": [
            "ro-control"
          ],
          "architectures": [
            "x86_64",
            "aarch64"
          ],
          "risk_class": "normal-app",
          "promotion_group": "ro-control",
          "required_tests": [
            "dependency-solve",
            "clean-install",
            "upgrade",
            "file-conflict",
            "rpmlint",
            "smoke"
          ],
          "srpm_required": true,
          "sbom_required": false,
          "allow_fedora_override": false,
          "trusted_signer_workflow": "Project-Ro-ASD/ro-Control/.github/workflows/release.yml"
        }
      ]
    },
    {
      "repository": "Project-Ro-ASD/ro-Assist",
      "owner": "Project-Ro-ASD/ro-Assist maintainers",
      "components": [
        {
          "component": "ro-assist",
          "package_names": [
            "ro-assist"
          ],
          "architectures": [
            "x86_64",
            "aarch64"
          ],
          "risk_class": "normal-app",
          "promotion_group": "ro-assist",
          "required_tests": [
            "dependency-solve",
            "clean-install",
            "upgrade",
            "file-conflict",
            "rpmlint",
            "smoke"
          ],
          "srpm_required": true,
          "sbom_required": false,
          "allow_fedora_override": false,
          "trusted_signer_workflow": "Project-Ro-ASD/ro-Assist/.github/workflows/release.yml"
        }
      ]
    },
    {
      "repository": "Project-Ro-ASD/Ro-Theme",
      "owner": "Project-Ro-ASD/Ro-Theme maintainers",
      "components": [
        {
          "component": "ro-theme",
          "package_names": [
            "ro-theme"
          ],
          "architectures": [
            "noarch"
          ],
          "risk_class": "critical-desktop",
          "promotion_group": "desktop-theme",
          "required_tests": [
            "dependency-solve",
            "clean-install",
            "upgrade",
            "file-conflict",
            "rpmlint",
            "smoke",
            "plasma-integration",
            "login-session"
          ],
          "srpm_required": true,
          "sbom_required": false,
          "allow_fedora_override": false,
          "trusted_signer_workflow": "Project-Ro-ASD/Ro-Theme/.github/workflows/release.yml"
        }
      ]
    },
    {
      "repository": "Project-Ro-ASD/ro-widgets",
      "owner": "Project-Ro-ASD/ro-widgets maintainers",
      "components": [
        {
          "component": "ro-widgets",
          "package_names": [
            "ro-widgets"
          ],
          "architectures": [
            "noarch"
          ],
          "risk_class": "critical-desktop",
          "promotion_group": "ro-widgets",
          "required_tests": [
            "dependency-solve",
            "clean-install",
            "upgrade",
            "file-conflict",
            "rpmlint",
            "smoke",
            "plasma-integration",
            "login-session"
          ],
          "srpm_required": true,
          "sbom_required": false,
          "allow_fedora_override": false,
          "trusted_signer_workflow": "Project-Ro-ASD/ro-widgets/.github/workflows/release.yml",
          "require_complete_architecture_set": true
        }
      ]
    },
    {
      "repository": "Project-Ro-ASD/Ro-ASD-release",
      "owner": "Project-Ro-ASD/Ro-ASD-release maintainers",
      "components": [
        {
          "component": "ro-asd-release",
          "package_names": [
            "ro-asd-release"
          ],
          "architectures": [
            "noarch"
          ],
          "risk_class": "critical-system",
          "promotion_group": "ro-asd-release",
          "required_tests": [
            "dependency-solve",
            "clean-install",
            "upgrade",
            "file-conflict",
            "rpmlint",
            "smoke"
          ],
          "srpm_required": true,
          "sbom_required": false,
          "allow_fedora_override": false,
          "trusted_signer_workflow": "Project-Ro-ASD/Ro-ASD-release/.github/workflows/release.yml"
        },
        {
          "component": "ro-asd-keyring",
          "package_names": [
            "ro-asd-keyring"
          ],
          "architectures": [
            "noarch"
          ],
          "risk_class": "critical-system",
          "promotion_group": "ro-asd-keyring",
          "required_tests": [
            "dependency-solve",
            "clean-install",
            "upgrade",
            "file-conflict",
            "rpmlint",
            "smoke"
          ],
          "srpm_required": true,
          "sbom_required": false,
          "allow_fedora_override": false,
          "trusted_signer_workflow": "Project-Ro-ASD/Ro-ASD-release/.github/workflows/release-keyring.yml"
        },
        {
          "component": "ro-asd-repos",
          "package_names": [
            "ro-asd-repos"
          ],
          "architectures": [
            "noarch"
          ],
          "risk_class": "critical-system",
          "promotion_group": "ro-asd-repos",
          "required_tests": [
            "dependency-solve",
            "clean-install",
            "upgrade",
            "file-conflict",
            "rpmlint",
            "smoke"
          ],
          "srpm_required": true,
          "sbom_required": false,
          "allow_fedora_override": false,
          "trusted_signer_workflow": "Project-Ro-ASD/Ro-ASD-release/.github/workflows/release-repos.yml"
        },
        {
          "component": "ro-asd-defaults",
          "package_names": [
            "ro-asd-defaults"
          ],
          "architectures": [
            "noarch"
          ],
          "risk_class": "critical-system",
          "promotion_group": "ro-asd-defaults",
          "required_tests": [
            "dependency-solve",
            "clean-install",
            "upgrade",
            "file-conflict",
            "rpmlint",
            "smoke"
          ],
          "srpm_required": true,
          "sbom_required": false,
          "allow_fedora_override": false,
          "trusted_signer_workflow": "Project-Ro-ASD/Ro-ASD-release/.github/workflows/release-defaults.yml"
        },
        {
          "component": "ro-asd-branding",
          "package_names": [
            "ro-asd-branding"
          ],
          "architectures": [
            "noarch"
          ],
          "risk_class": "critical-desktop",
          "promotion_group": "ro-asd-branding",
          "required_tests": [
            "dependency-solve",
            "clean-install",
            "upgrade",
            "file-conflict",
            "rpmlint",
            "smoke"
          ],
          "srpm_required": true,
          "sbom_required": false,
          "allow_fedora_override": false,
          "trusted_signer_workflow": "Project-Ro-ASD/Ro-ASD-release/.github/workflows/release-branding.yml"
        },
        {
          "component": "ro-asd-desktop-standard",
          "package_names": [
            "ro-asd-desktop-standard"
          ],
          "architectures": [
            "noarch"
          ],
          "risk_class": "critical-desktop",
          "promotion_group": "ro-asd-desktop-standard",
          "required_tests": [
            "dependency-solve",
            "clean-install",
            "upgrade",
            "file-conflict",
            "rpmlint",
            "smoke"
          ],
          "srpm_required": true,
          "sbom_required": false,
          "allow_fedora_override": false,
          "trusted_signer_workflow": "Project-Ro-ASD/Ro-ASD-release/.github/workflows/release-desktop-standard.yml"
        },
        {
          "component": "ro-asd-kernel-policy",
          "package_names": [
            "ro-asd-kernel-policy"
          ],
          "architectures": [
            "noarch"
          ],
          "risk_class": "critical-system",
          "promotion_group": "ro-asd-kernel-policy",
          "required_tests": [
            "dependency-solve",
            "clean-install",
            "upgrade",
            "file-conflict",
            "rpmlint",
            "smoke"
          ],
          "srpm_required": true,
          "sbom_required": false,
          "allow_fedora_override": false,
          "trusted_signer_workflow": "Project-Ro-ASD/Ro-ASD-release/.github/workflows/release-kernel-policy.yml"
        }
      ]
    },
    {
      "repository": "Project-Ro-ASD/ro-Installer",
      "owner": "Project-Ro-ASD/ro-Installer maintainers",
      "components": [
        {
          "component": "ro-installer",
          "package_names": [
            "ro-installer"
          ],
          "architectures": [
            "x86_64"
          ],
          "risk_class": "critical-system",
          "promotion_group": "ro-installer",
          "required_tests": [
            "dependency-solve",
            "clean-install",
            "upgrade",
            "file-conflict",
            "rpmlint",
            "smoke"
          ],
          "srpm_required": true,
          "sbom_required": false,
          "allow_fedora_override": false,
          "trusted_signer_workflow": "Project-Ro-ASD/ro-Installer/.github/workflows/release.yml",
          "require_complete_architecture_set": true
        }
      ]
    },
    {
      "repository": "Project-Ro-ASD/Ro-KDE-Dolphin",
      "owner": "Project-Ro-ASD/Ro-KDE-Dolphin maintainers",
      "components": [
        {
          "component": "ro-kde-dolphin",
          "package_names": [
            "dolphin",
            "dolphin-libs",
            "dolphin-devel"
          ],
          "architectures": [